{
  "schemaVersion": 1,
  "site": {
    "title": {
      "en": "Seif's Room",
      "de": "Seifs Raum",
      "fr": "La chambre de Seif"
    },
    "description": {
      "en": "My Portfolio Room",
      "de": "Mein Portfolio-Raum",
      "fr": "Mon portfolio en pixel art"
    },
    "previewImage": "content/demo.gif"
  },
  "projects": {
    "placeholder": false,
    "items": [
      {
        "id": "project-one",
        "name": {
          "en": "Code Atlas",
          "de": "Code Atlas",
          "fr": "Code Atlas"
        },
        "thumbnail": "content/projects/project-one/timeline.gif",
        "description": {
          "en": "Explore unfamiliar codebases through visual maps, dependencies and risk signals.",
          "de": "Unbekannte Codebasen über visuelle Karten, Abhängigkeiten und Risiken erkunden.",
          "fr": "Explore du code inconnu via des cartes visuelles, dépendances et risques."
        },
        "tags": [
          "DevTools",
          "Graphs",
          "Analysis"
        ],
        "badge": "",
        "cta": {
          "label": {
            "en": "Live Demo",
            "de": "Live-Demo",
            "fr": "Démo en ligne"
          },
          "url": "https://code-atlas.up.railway.app/"
        },
        "say": {
          "en": "New repo? I built this to see its structure before diving into the code.",
          "de": "Neues Repo? Damit sehe ich seine Struktur, bevor ich in den Code eintauche.",
          "fr": "Nouveau repo ? Je l'ai créé pour voir sa structure avant de plonger dans le code."
        },
        "detail": {
          "summary": {
            "en": "Code Atlas turns JavaScript and Python repositories into navigable visual maps. Explore files, functions, dependencies and structural clusters, then inspect risk signals and simulated refactoring effects. It is designed to accelerate the first hours in an unfamiliar codebase, not to replace reading or reviewing source code.",
            "de": "Code Atlas verwandelt JavaScript- und Python-Repositories in navigierbare visuelle Karten. Erkunde Dateien, Funktionen, Abhängigkeiten und strukturelle Cluster und prüfe dann Risikosignale und simulierte Refactorings. Es soll die ersten Stunden in einer fremden Codebasis beschleunigen, nicht das Lesen oder Reviewen des Codes ersetzen.",
            "fr": "Code Atlas transforme des dépôts JavaScript et Python en cartes visuelles navigables. Explore fichiers, fonctions, dépendances et groupes structurels, puis examine les signaux de risque et l'effet simulé d'un refactoring. Il accélère les premières heures dans un code inconnu, sans remplacer la lecture ni la relecture du code."
          },
          "role": {
            "en": "Solo builder",
            "de": "Solo-Entwickler",
            "fr": "Développeur solo"
          },
          "stack": [
            "React",
            "React Flow",
            "JavaScript",
            "Python"
          ],
          "highlight": {
            "en": "Built a deterministic code-analysis pipeline that transforms source code into dependency graphs, risk signals and refactor simulations, without relying on AI.",
            "de": "Eine deterministische Code-Analyse-Pipeline, die Quellcode ohne KI in Abhängigkeitsgraphen, Risikosignale und Refactoring-Simulationen umwandelt.",
            "fr": "Un pipeline d'analyse de code déterministe qui transforme le code en graphes de dépendances, signaux de risque et simulations de refactoring, sans IA."
          },
          "gallery": [
            {
              "type": "image",
              "src": "content/projects/project-one/navigation.gif",
              "alt": ""
            },
            {
              "type": "image",
              "src": "content/projects/project-one/source.gif",
              "alt": ""
            },
            {
              "type": "image",
              "src": "content/projects/project-one/timeline.gif",
              "alt": ""
            },
            {
              "type": "image",
              "src": "content/projects/project-one/demo.gif",
              "alt": ""
            }
          ],
          "links": [
            {
              "label": "GitHub Repository",
              "url": "https://github.com/Seifpetit/code-atlas"
            }
          ]
        }
      },
      {
        "id": "project-two",
        "name": {
          "en": "PRISM",
          "de": "PRISM",
          "fr": "PRISM"
        },
        "thumbnail": "content/projects/project-two/prism-creatives.webm",
        "description": {
          "en": "An AI workspace for building and testing structured e-commerce ad strategies.",
          "de": "KI-Workspace zum Bauen und Testen strukturierter E-Commerce-Werbestrategien.",
          "fr": "Un espace IA pour créer et tester des stratégies pub e-commerce structurées."
        },
        "tags": [
          "AI",
          "SaaS",
          "E-commerce"
        ],
        "badge": "Featured",
        "cta": {
          "label": {
            "en": "Repo",
            "de": "Repo",
            "fr": "Dépôt"
          },
          "url": "https://github.com/Seifpetit/PRISM"
        },
        "say": {
          "en": "Your best ad ever, and zero idea why... PRISM gets your marketing in order",
          "de": "Deine beste Anzeige aller Zeiten, und keine Ahnung warum... PRISM ordnet dein Marketing.",
          "fr": "Ta meilleure pub, et aucune idée de pourquoi... PRISM met de l'ordre dans ton marketing."
        },
        "detail": {
          "summary": {
            "en": "PRISM helps e-commerce teams turn product information into structured marketing experiments. It organizes audiences, angles and offers, then combines them into campaign-ready ad sets. AI-assisted generation stays connected to persistent records and inspectable execution logs, so the workflow is more than a one-off prompt.",
            "de": "PRISM hilft E-Commerce-Teams, Produktinformationen in strukturierte Marketing-Experimente zu verwandeln. Es ordnet Zielgruppen, Blickwinkel und Angebote und kombiniert sie zu einsatzbereiten Anzeigengruppen. Die KI-Generierung bleibt mit dauerhaften Datensätzen und nachvollziehbaren Ausführungsprotokollen verbunden, also mehr als ein einmaliger Prompt.",
            "fr": "PRISM aide les équipes e-commerce à transformer les infos produit en expériences marketing structurées. Il organise audiences, angles et offres, puis les combine en ensembles de pubs prêts à lancer. La génération assistée par IA reste liée à des données persistantes et à des journaux d'exécution consultables : bien plus qu'un simple prompt."
          },
          "role": {
            "en": "Solo builder",
            "de": "Solo-Entwickler",
            "fr": "Développeur solo"
          },
          "stack": [
            "React",
            "TypeScript",
            "Node.js",
            "PostgreSQL",
            "OpenAI/Claude API"
          ],
          "highlight": {
            "en": "Designed an inspectable AI workflow that turns product context into structured campaign decisions while preserving their relationships and generation traces.",
            "de": "Ein nachvollziehbarer KI-Workflow, der Produktkontext in strukturierte Kampagnenentscheidungen umwandelt und ihre Beziehungen und Herkunft bewahrt.",
            "fr": "Un workflow IA transparent qui transforme le contexte produit en décisions de campagne structurées, en gardant leurs liens et leur historique."
          },
          "gallery": [
            {
              "type": "video",
              "src": "content/projects/project-two/prism-creatives.webm",
              "alt": ""
            },
            {
              "type": "image",
              "src": "content/projects/project-two/prism-pipeline.gif",
              "alt": ""
            },
            {
              "type": "image",
              "src": "content/projects/project-two/prism-performance.gif",
              "alt": ""
            }
          ],
          "links": []
        }
      },
      {
        "id": "project-three",
        "name": {
          "en": "Seif's Room",
          "de": "Seifs Raum",
          "fr": "La chambre de Seif"
        },
        "thumbnail": "content/projects/project-three/demo.mp4",
        "description": {
          "en": "An interactive pixel-art room powered by a custom editor and Git publishing.",
          "de": "Ein interaktiver Pixel-Art-Raum mit eigenem Editor und Git-Veröffentlichung.",
          "fr": "Une chambre interactive en pixel art, avec son éditeur et publication via Git."
        },
        "tags": [
          "JavaScript",
          "Canvas",
          "Node.js"
        ],
        "badge": "New",
        "cta": {
          "label": {
            "en": "Repo",
            "de": "Repo",
            "fr": "Dépôt"
          },
          "url": "https://github.com/Seifpetit/Portfolio-room"
        },
        "say": {
          "en": "Welcome to my room! I also built the editor behind it. Everything you see is mine to change.",
          "de": "Willkommen in meinem Raum! Den Editor dahinter habe ich auch gebaut. Alles hier kann ich ändern.",
          "fr": "Bienvenue dans ma chambre ! J'ai aussi créé l'éditeur derrière. Je peux tout y changer."
        },
        "detail": {
          "summary": {
            "en": "An interactive portfolio built as an explorable isometric room. Visitors navigate between projects, my CV and contact through a pixel-art environment. Behind it sits a private authoring system for managing content, translations, spatial zones etc... Changes are published through an automated Git workflow, keeping the public site static while making the experience easy to extend.",